{
  "$schema": "https://json-schema.org/draft/2020-12/schema",
  "$id": "https://github.com/teruokun/crate-tracing/schemas/finding-v1.schema.json",
  "title": "crate-tracing finding",
  "description": "What one measurement (crate, version, features, profile) showed about where the crate's native code comes from, with pointers into the BuildWarden ledger that is its evidence. Keyed by purl so it can populate package records (e.g. ecosyste.ms).",
  "type": "object",
  "required": ["schema", "subject", "measurement", "outcome", "routes", "downloads", "packages", "crates", "traffic", "evidence", "anomalies"],
  "properties": {
    "schema": { "const": "https://github.com/teruokun/crate-tracing/schemas/finding-v1.schema.json" },
    "subject": {
      "description": "The crate the measurement depends on.",
      "type": "object",
      "required": ["purl", "name", "version", "features", "default_features"],
      "properties": {
        "purl": { "type": "string", "pattern": "^pkg:cargo/" },
        "name": { "type": "string" },
        "version": { "type": "string" },
        "features": { "type": "array", "items": { "type": "string" } },
        "default_features": { "type": "boolean" }
      }
    },
    "measurement": {
      "type": "object",
      "required": ["id", "profile"],
      "properties": {
        "id": { "type": "string" },
        "profile": {
          "type": "object",
          "required": ["name", "image"],
          "properties": {
            "name": { "type": "string" },
            "image": { "type": "string", "description": "Base image, pinned by digest." },
            "apt_packages": { "type": "array", "items": { "type": "string" } }
          }
        },
        "arch": { "type": ["string", "null"] },
        "host_triple": { "type": ["string", "null"] },
        "rustc": { "type": ["string", "null"] },
        "cargo": { "type": ["string", "null"] },
        "os": { "type": ["string", "null"] },
        "measured_at": { "type": "string", "format": "date-time" },
        "warden_exit": { "type": "integer" },
        "wall_seconds": { "type": "number", "description": "Wall time of `warden build`, setup included." },
        "output_bytes": { "type": "integer", "description": "Size of warden's output, payload captures included." },
        "tool": {
          "type": "object",
          "required": ["crate_tracing", "warden"],
          "properties": {
            "crate_tracing": { "type": "string" },
            "warden": {
              "description": "The BuildWarden that produced the ledger. Rebuild with: go install github.com/buildwarden/buildwarden/cmd/warden@<revision>.",
              "type": ["object", "null"],
              "properties": {
                "version": { "type": ["string", "null"] },
                "revision": { "type": "string", "description": "git commit (vcs.revision from Go build info)" },
                "revision_time": { "type": "string" },
                "modified": { "type": "boolean", "description": "true when built from a dirty tree: not reproducible" },
                "module": { "type": "string" },
                "module_version": { "type": ["string", "null"] },
                "go": { "type": "string" },
                "binary_sha256": { "type": "string" },
                "path": { "type": "string" }
              }
            }
          }
        }
      }
    },
    "outcome": {
      "type": "object",
      "required": ["status", "built"],
      "properties": {
        "status": { "enum": ["measured", "incomplete"], "description": "incomplete: the ledger failed verification or a phase marker is missing, so phase attribution is unreliable." },
        "fetch_exit": { "type": ["integer", "null"] },
        "build_exit": { "type": ["integer", "null"] },
        "built": { "type": ["boolean", "null"], "description": "null when the build did not run." },
        "failure": {
          "type": ["object", "null"],
          "properties": {
            "package": { "type": "string" },
            "version": { "type": "string" },
            "excerpt": { "type": "array", "items": { "type": "string" } }
          }
        }
      }
    },
    "routes": {
      "type": "object",
      "required": ["taken", "A_downloads", "B_bundled", "C_system", "D_tools", "C_unresolved"],
      "properties": {
        "taken": { "type": "array", "items": { "enum": ["A", "B", "C", "D", "unresolved", "none", "fail"] } },
        "A_downloads": { "type": "array", "items": { "type": "integer" }, "description": "Ledger sequence numbers of the downloads (entries in `downloads`), redirects excluded." },
        "B_bundled": { "type": "array", "items": { "$ref": "#/$defs/bundled" } },
        "C_system": { "type": "array", "items": { "$ref": "#/$defs/link_lib" } },
        "C_unresolved": {
          "type": "array",
          "items": { "$ref": "#/$defs/link_lib" },
          "description": "System libraries a build script asked to link that nothing on the system provides. The probe is a library, so only a downstream binary would fail."
        },
        "D_tools": {
          "type": "array",
          "items": {
            "type": "object",
            "required": ["purl", "tools"],
            "properties": {
              "purl": { "type": "string" },
              "tools": { "type": "object", "additionalProperties": { "type": "integer" } }
            }
          }
        }
      }
    },
    "downloads": { "type": "array", "items": { "$ref": "#/$defs/download" } },
    "packages": { "type": "array", "items": { "$ref": "#/$defs/package" } },
    "crates": {
      "type": "array",
      "items": {
        "type": "object",
        "required": ["purl", "ledger_seq"],
        "properties": {
          "purl": { "type": "string" },
          "phase": { "type": "string" },
          "ledger_seq": { "type": "integer" },
          "sha256": { "type": ["string", "null"] },
          "lock_checksum_match": { "type": ["boolean", "null"] },
          "links": { "type": ["string", "null"] },
          "has_build_script": { "type": ["boolean", "null"] }
        }
      }
    },
    "traffic": { "type": "object", "description": "phase -> request class -> {requests, bytes, hosts}." },
    "evidence": {
      "type": "object",
      "properties": {
        "ledger_valid": { "type": "boolean" },
        "ledger_records": { "type": ["integer", "null"] },
        "environment_type": { "type": ["string", "null"] },
        "environment_digest": { "type": ["string", "null"] },
        "artifacts_verified": { "type": "boolean" }
      }
    },
    "anomalies": { "type": "array", "items": { "type": "string" } },
    "expect": { "type": "array", "items": { "type": "string" } },
    "matches_expectation": { "type": ["boolean", "null"] }
  },
  "$defs": {
    "identity": {
      "type": "object",
      "required": ["method", "confidence"],
      "properties": {
        "name": { "type": "string" },
        "version": { "type": "string" },
        "method": { "type": "string", "description": "semver-build-metadata, github-release-tag, github-archive-tag, url-filename, url-name@version, url-path-version, archive-root-dir, or redirect-from:<method>." },
        "confidence": { "enum": ["high", "medium", "low"] },
        "source_crate": { "type": "string" }
      }
    },
    "download": {
      "type": "object",
      "required": ["ledger_seq", "method", "url", "hashes"],
      "properties": {
        "ledger_seq": { "type": "integer" },
        "method": { "type": "string" },
        "url": { "type": "string" },
        "status": { "type": ["integer", "null"] },
        "bytes": { "type": "integer" },
        "hashes": { "type": "object", "additionalProperties": { "type": "string" } },
        "complete": { "type": "boolean" },
        "redirect_to": { "type": "string" },
        "user_agent": { "type": "string" },
        "capture": { "type": "string" },
        "archive_root": { "type": "string" },
        "identified": { "$ref": "#/$defs/identity" }
      }
    },
    "link_lib": {
      "type": "object",
      "required": ["name", "kind", "origin"],
      "properties": {
        "purl": { "type": "string" },
        "name": { "type": "string" },
        "kind": { "type": "string" },
        "origin": { "enum": ["in-tree", "system", "external", "unresolved"], "description": "system: owned by an OS package; external: a file outside the build tree that no OS package owns (a downloaded archive, say)." },
        "path": { "type": "string" },
        "os_package": { "type": "object", "properties": { "name": { "type": "string" }, "version": { "type": ["string", "null"] } } },
        "os_runtime_package": { "type": "object", "properties": { "name": { "type": "string" }, "version": { "type": ["string", "null"] } } },
        "baseline": { "type": "boolean" }
      }
    },
    "bundled": {
      "type": "object",
      "required": ["purl", "c_compilations", "libs"],
      "properties": {
        "purl": { "type": "string" },
        "c_compilations": { "type": "integer" },
        "libs": { "type": "array", "items": { "type": "string" } },
        "native": { "$ref": "#/$defs/identity" }
      }
    },
    "package": {
      "type": "object",
      "required": ["purl", "c_compilations", "link_libs", "tools"],
      "properties": {
        "purl": { "type": "string" },
        "links": { "type": ["string", "null"] },
        "build_script_ran": { "type": "boolean" },
        "c_compilations": { "type": "integer" },
        "link_libs": { "type": "array", "items": { "$ref": "#/$defs/link_lib" } },
        "tools": { "type": "object", "additionalProperties": { "type": "integer" } },
        "pkg_config_probes": { "type": "array", "items": { "type": "string" } },
        "declared": { "type": "object", "additionalProperties": { "type": "string" } },
        "bundled_native": { "$ref": "#/$defs/identity" },
        "built_in_tree": { "type": "boolean" },
        "prebuilt_in_tree": { "type": "boolean" },
        "ambiguous_version": { "type": "boolean" }
      }
    }
  }
}
