{
  "schema": "https://github.com/teruokun/crate-tracing/schemas/finding-v1.schema.json",
  "subject": {
    "purl": "pkg:cargo/aws-lc-sys@0.47.0",
    "name": "aws-lc-sys",
    "version": "0.47.0",
    "features": [],
    "default_features": true
  },
  "measurement": {
    "id": "aws-lc-sys-0.47.0",
    "profile": {
      "name": "minimal",
      "image": "rust:1.98.1-slim-trixie@sha256:4cd829461bd5c4d511c32e269da9cb8929223b666519d8004e35fc8d1d771ab7",
      "apt_packages": [
        "build-essential",
        "pkg-config",
        "cmake",
        "perl",
        "python3",
        "git",
        "curl"
      ]
    },
    "arch": "aarch64",
    "host_triple": "aarch64-unknown-linux-gnu",
    "rustc": "rustc 1.98.1 (48a229cea 2026-09-01)",
    "cargo": "cargo 1.98.1 (797e8a9bc 2026-08-05)",
    "os": "Debian GNU/Linux 13 (trixie)",
    "measured_at": "2026-10-30T17:31:18+00:00",
    "tool": {
      "crate_tracing": "0.1.0",
      "warden": {
        "path": "/Users/jeff/crate-tracing/.tools/buildwarden/dist/warden",
        "binary_sha256": "7eb4119b85a04f3f1d4e61179e1254117bd14516a2e57bceee26a11421320b27",
        "version": "dev",
        "go": "go1.26.5",
        "module": "github.com/buildwarden/buildwarden",
        "module_version": "v0.5.1-0.20261029195147-137feae2f8b0",
        "revision": "137feae2f8b07e19e21b0893cc4ec9e96f97d42f",
        "revision_time": "2026-10-29T19:51:47Z",
        "modified": false
      }
    },
    "warden_exit": 0,
    "wall_seconds": 20.1,
    "output_bytes": 163200541
  },
  "outcome": {
    "status": "measured",
    "fetch_exit": 0,
    "build_exit": 0,
    "built": true,
    "failure": null
  },
  "routes": {
    "taken": [
      "B"
    ],
    "A_downloads": [],
    "B_bundled": [
      {
        "purl": "pkg:cargo/aws-lc-sys@0.47.0",
        "c_compilations": 400,
        "libs": [
          "aws_lc_0_47_0_crypto"
        ]
      }
    ],
    "C_system": [],
    "D_tools": [],
    "C_unresolved": []
  },
  "downloads": [],
  "packages": [
    {
      "purl": "pkg:cargo/aws-lc-sys@0.47.0",
      "links": "aws_lc_0_47_0",
      "build_script_ran": true,
      "c_compilations": 400,
      "link_libs": [
        {
          "name": "aws_lc_0_47_0_crypto",
          "kind": "static",
          "origin": "in-tree",
          "path": "/work/probe/target/debug/build/aws-lc-sys-8511776eecd417cf/out/libaws_lc_0_47_0_crypto.a"
        }
      ],
      "tools": {},
      "pkg_config_probes": [
        "--libs --cflags aws-lc",
        "--libs --cflags libcrypto",
        "--libs --cflags libcrypto-awslc",
        "--libs --cflags openssl"
      ],
      "declared": {},
      "built_in_tree": true
    },
    {
      "purl": "pkg:cargo/libc@0.2.191",
      "links": null,
      "build_script_ran": true,
      "c_compilations": 0,
      "link_libs": [],
      "tools": {},
      "pkg_config_probes": [],
      "declared": {}
    }
  ],
  "crates": [
    {
      "purl": "pkg:cargo/aws-lc-sys@0.47.0",
      "name": "aws-lc-sys",
      "version": "0.47.0",
      "phase": "fetch",
      "ledger_seq": 384,
      "sha256": "8bfbe32ac36b3c428696ce315464181bc4029d689fd58e3f2a4e58c252242f52",
      "lock_checksum_match": true,
      "links": "aws_lc_0_47_0",
      "has_build_script": true
    },
    {
      "purl": "pkg:cargo/pkg-config@0.3.34",
      "name": "pkg-config",
      "version": "0.3.34",
      "phase": "fetch",
      "ledger_seq": 388,
      "sha256": "f6b464fbc74e149a392436b17d523f769e057cb6877f6a5c4618bc6f11800548",
      "lock_checksum_match": true,
      "links": null,
      "has_build_script": false
    },
    {
      "purl": "pkg:cargo/fs_extra@1.3.0",
      "name": "fs_extra",
      "version": "1.3.0",
      "phase": "fetch",
      "ledger_seq": 390,
      "sha256": "42703706b716c37f96a77aea830392ad231f44c9e9a67872fa5548707e11b11c",
      "lock_checksum_match": true,
      "links": null,
      "has_build_script": false
    },
    {
      "purl": "pkg:cargo/cc@1.10.0",
      "name": "cc",
      "version": "1.10.0",
      "phase": "fetch",
      "ledger_seq": 394,
      "sha256": "86e055fa6e3e40ad6187ba25b6855eeb635d5271f8e0f0e1e9a5826b8d75bea0",
      "lock_checksum_match": true,
      "links": null,
      "has_build_script": false
    },
    {
      "purl": "pkg:cargo/jobserver@0.1.35",
      "name": "jobserver",
      "version": "0.1.35",
      "phase": "fetch",
      "ledger_seq": 399,
      "sha256": "1c00acbd29eabad4a2392fa0e921c874934dbbf4194312ad20f04a0ed67a3cb3",
      "lock_checksum_match": true,
      "links": null,
      "has_build_script": false
    },
    {
      "purl": "pkg:cargo/cfg-if@1.0.5",
      "name": "cfg-if",
      "version": "1.0.5",
      "phase": "fetch",
      "ledger_seq": 403,
      "sha256": "4e7648175b45a9a48536d676f68d918270699102aa8dab5496df06904c914600",
      "lock_checksum_match": true,
      "links": null,
      "has_build_script": null
    },
    {
      "purl": "pkg:cargo/cmake@0.1.58",
      "name": "cmake",
      "version": "0.1.58",
      "phase": "fetch",
      "ledger_seq": 406,
      "sha256": "c0f78a02292a74a88ac736019ab962ece0bc380e3f977bf72e376c5d78ff0678",
      "lock_checksum_match": true,
      "links": null,
      "has_build_script": false
    },
    {
      "purl": "pkg:cargo/getrandom@0.4.3",
      "name": "getrandom",
      "version": "0.4.3",
      "phase": "fetch",
      "ledger_seq": 411,
      "sha256": "300e883d756b2e4ec94e02791f39b04b522276138852cfc41d9fb7e904106099",
      "lock_checksum_match": true,
      "links": null,
      "has_build_script": null
    },
    {
      "purl": "pkg:cargo/dunce@1.0.5",
      "name": "dunce",
      "version": "1.0.5",
      "phase": "fetch",
      "ledger_seq": 414,
      "sha256": "92773504d58c093f6de2459af4af33faa518c13451eb8f2b5698ed3d36e7c813",
      "lock_checksum_match": true,
      "links": null,
      "has_build_script": false
    },
    {
      "purl": "pkg:cargo/r-efi@6.0.0",
      "name": "r-efi",
      "version": "6.0.0",
      "phase": "fetch",
      "ledger_seq": 419,
      "sha256": "f8dcc9c7d52a811697d2151c701e0d08956f92b0e24136cf4cf27b57a6a0d9bf",
      "lock_checksum_match": true,
      "links": null,
      "has_build_script": null
    },
    {
      "purl": "pkg:cargo/libc@0.2.191",
      "name": "libc",
      "version": "0.2.191",
      "phase": "fetch",
      "ledger_seq": 422,
      "sha256": "65cd87c9a6d60536580b316ad985726104730a5151c99845f2490428ef91240a",
      "lock_checksum_match": true,
      "links": null,
      "has_build_script": true
    },
    {
      "purl": "pkg:cargo/find-msvc-tools@0.1.15",
      "name": "find-msvc-tools",
      "version": "0.1.15",
      "phase": "fetch",
      "ledger_seq": 427,
      "sha256": "1c66915cc5391097de7a2b0b972e8505aa33c0df401fd3a6811dbdb32881ba48",
      "lock_checksum_match": true,
      "links": null,
      "has_build_script": false
    },
    {
      "purl": "pkg:cargo/shlex@2.0.1",
      "name": "shlex",
      "version": "2.0.1",
      "phase": "fetch",
      "ledger_seq": 430,
      "sha256": "f8fadd59c855ef2080decdef8ff161eb6661b86933c9d82e5ba29dc602a55aba",
      "lock_checksum_match": true,
      "links": null,
      "has_build_script": false
    }
  ],
  "traffic": {
    "setup": {
      "os-packages": {
        "requests": 77,
        "bytes": 69743858,
        "hosts": [
          "deb.debian.org"
        ]
      }
    },
    "fetch": {
      "crates-registry": {
        "requests": 27,
        "bytes": 11547496,
        "hosts": [
          "index.crates.io",
          "static.crates.io"
        ]
      }
    }
  },
  "evidence": {
    "ledger_valid": true,
    "ledger_records": 477,
    "environment_type": "oci-image/v1",
    "environment_digest": "sha256:4cd829461bd5c4d511c32e269da9cb8929223b666519d8004e35fc8d1d771ab7",
    "artifacts_verified": true
  },
  "anomalies": [],
  "expect": [
    "B"
  ],
  "matches_expectation": true
}
